{
  "consentVotes": [
    {
      "action": "Adopted on the General Consent Report",
      "motion": "A motion was made by Yee, seconded by HintonHodge, to Approve the General Consent Report. The motion carried by the following vote",
      "mover": "Gary Yee",
      "passed": "Pass",
      "seconder": "Jumoke HintonHodge",
      "section": "Adoption of the General Consent Report",
      "title": "Approval of the General Consent Report",
      "votes": [
        {
          "name": "Denilson Garibo",
          "vote": "Absent"
        },
        {
          "name": "Mica Smith-Dahl",
          "vote": "Absent"
        },
        {
          "name": "Jumoke HintonHodge",
          "vote": "Aye"
        },
        {
          "name": "Gary Yee",
          "vote": "Aye"
        },
        {
          "name": "Roseann Torres",
          "vote": "Aye"
        },
        {
          "name": "James Harris",
          "vote": "Nay"
        },
        {
          "name": "Aimee Eng",
          "vote": "Aye"
        },
        {
          "name": "Shanthi Gonzales",
          "vote": "Aye"
        },
        {
          "name": "Jody London",
          "vote": "Aye"
        }
      ]
    },
    {
      "action": "Adopted on the General Consent Report",
      "motion": "A motion was made by Yee, seconded by Torres, to Approve the General Consent Report. The motion carried by the following vote",
      "mover": "Gary Yee",
      "passed": "Pass",
      "seconder": "Roseann Torres",
      "section": "Adoption of the General Consent Report - Measures B and J",
      "title": "Approval of the General Consent Report - Measures B and J",
      "votes": [
        {
          "name": "Denilson Garibo",
          "vote": "Absent"
        },
        {
          "name": "Mica Smith-Dahl",
          "vote": "Absent"
        },
        {
          "name": "Jumoke HintonHodge",
          "vote": "Aye"
        },
        {
          "name": "Gary Yee",
          "vote": "Aye"
        },
        {
          "name": "Roseann Torres",
          "vote": "Aye"
        },
        {
          "name": "James Harris",
          "vote": "Nay"
        },
        {
          "name": "Aimee Eng",
          "vote": "Aye"
        },
        {
          "name": "Shanthi Gonzales",
          "vote": "Aye"
        },
        {
          "name": "Jody London",
          "vote": "Aye"
        }
      ]
    }
  ],
  "eventId": 4590,
  "fetchedAt": "2026-10-03T18:02:41.642Z",
  "items": [
    {
      "agendaNumber": "P.-1",
      "agendaSequence": 37,
      "attachments": [
        {
          "name": "20-0734 Professional Services Contract - Kyleigh Nevis - Technology Services Department",
          "url": "https://legistar.granicus.com/ousd/attachments/94937.pdf"
        }
      ],
      "consentSection": "general",
      "file": "20-0734",
      "fundingSource": null,
      "group": "Chief, Systems and Services Officer",
      "history": [
        {
          "action": "Adopted on the General Consent Report",
          "body": "Board of Education",
          "consent": true,
          "date": "2020-05-13",
          "eventId": 4590,
          "historyId": 300284,
          "motion": "A motion was made by Yee, seconded by HintonHodge, to Approve the General Consent Report. The motion carried by the following vote",
          "mover": "Gary Yee",
          "passed": "Pass",
          "seconder": "Jumoke HintonHodge",
          "votes": null
        }
      ],
      "introDate": "2020-04-08",
      "matterGuid": "041BDFF8-7549-4ADA-B75A-E45204963C48",
      "matterId": 49322,
      "matterType": "Agreement or Contract",
      "presenter": "Chief Systems and Services Officer",
      "resourceSite": "0000-986",
      "text": "Ratification by the Board of Education of a Professional Services Contract between the District and Kyleigh Nevis, Alameda, CA, for the latter work with staff, families and outside donors to coordinate device and internet access acquisition and distribution to students to support distance learning during the COVID-19 pandemic, via Technology Services Department, for the period of March 31, 2020 through June 30, 2020 in an amount not to exceed $30,000.00.",
      "title": "Professional Services Contract - Kyleigh Nevis - Technology Services Department",
      "vendorNo": "005826"
    },
    {
      "agendaNumber": "P.-2",
      "agendaSequence": 39,
      "attachments": [
        {
          "name": "20-0663 Accounts Payable Warrants - Fiscal Year 2019-2020 - As of January 31, 2020",
          "url": "https://legistar.granicus.com/ousd/attachments/94831.pdf"
        }
      ],
      "consentSection": "general",
      "file": "20-0663",
      "fundingSource": null,
      "group": "Chief Business Officer",
      "history": [
        {
          "action": "Adopted on the General Consent Report",
          "body": "Board of Education",
          "consent": true,
          "date": "2020-05-13",
          "eventId": 4590,
          "historyId": 300287,
          "motion": "A motion was made by Yee, seconded by HintonHodge, to Approve the General Consent Report. The motion carried by the following vote",
          "mover": "Gary Yee",
          "passed": "Pass",
          "seconder": "Jumoke HintonHodge",
          "votes": null
        }
      ],
      "introDate": "2020-03-31",
      "matterGuid": "4B34B5D5-4917-48AA-BFC0-A8489B10A5BD",
      "matterId": 49251,
      "matterType": "Motion",
      "presenter": "Chief Financial Officer",
      "resourceSite": null,
      "text": "Ratification by the Board of Education of Accounts Payable Warrants - i.e., 1,165 Accounts Payable Consolidated Checks printed - Fiscal Year 2019-2020, in the cumulative Amount of $26,485,657.57, from January 1, 2020 through January 31, 2020, as reflected in Exhibit 1.",
      "title": "Accounts Payable Warrants - Fiscal Year 2019-2020 - As of January 31, 2020",
      "vendorNo": null
    },
    {
      "agendaNumber": "P.-3",
      "agendaSequence": 40,
      "attachments": [
        {
          "name": "20-0664 Accounts Payable Warrants - Fiscal Year 2019-2020 - As of February 29, 2020",
          "url": "https://legistar.granicus.com/ousd/attachments/95106.pdf"
        }
      ],
      "consentSection": "general",
      "file": "20-0664",
      "fundingSource": null,
      "group": "Chief Business Officer",
      "history": [
        {
          "action": "Adopted on the General Consent Report",
          "body": "Board of Education",
          "consent": true,
          "date": "2020-05-13",
          "eventId": 4590,
          "historyId": 300288,
          "motion": "A motion was made by Yee, seconded by HintonHodge, to Approve the General Consent Report. The motion carried by the following vote",
          "mover": "Gary Yee",
          "passed": "Pass",
          "seconder": "Jumoke HintonHodge",
          "votes": null
        }
      ],
      "introDate": "2020-03-31",
      "matterGuid": "EB7EBD80-1A57-4F21-BFCE-1A3D689EFA25",
      "matterId": 49252,
      "matterType": "Motion",
      "presenter": "Chief Financial Officer",
      "resourceSite": null,
      "text": "Ratification by the Board of Education of Accounts Payable Warrants - i.e., 1,167 Accounts Payable Consolidated Checks printed - Fiscal Year 2019-2020, in the cumulative Amount of $29,148,192.23, from February 1, 2020 through February 29, 2020, as reflected in Exhibit 1.",
      "title": "Accounts Payable Warrants - Fiscal Year 2019-2020 - As of February 29, 2020",
      "vendorNo": null
    },
    {
      "agendaNumber": "P.-4",
      "agendaSequence": 41,
      "attachments": [
        {
          "name": "20-0665 Accounts Payable Warrants - Fiscal Year 2019-2020 - As of March 31, 2020",
          "url": "https://legistar.granicus.com/ousd/attachments/94833.pdf"
        }
      ],
      "consentSection": "general",
      "file": "20-0665",
      "fundingSource": null,
      "group": "Chief Business Officer",
      "history": [
        {
          "action": "Adopted on the General Consent Report",
          "body": "Board of Education",
          "consent": true,
          "date": "2020-05-13",
          "eventId": 4590,
          "historyId": 300289,
          "motion": "A motion was made by Yee, seconded by HintonHodge, to Approve the General Consent Report. The motion carried by the following vote",
          "mover": "Gary Yee",
          "passed": "Pass",
          "seconder": "Jumoke HintonHodge",
          "votes": null
        }
      ],
      "introDate": "2020-03-31",
      "matterGuid": "8411BD3A-B37A-428B-B1C0-FD7FC53BEBE2",
      "matterId": 49253,
      "matterType": "Motion",
      "presenter": "Chief Financial Officer",
      "resourceSite": null,
      "text": "Ratification by the Board of Education of Accounts Payable Warrants - i.e., 1,260 Accounts Payable Consolidated Checks printed - Fiscal Year 2019-2020, in the cumulative Amount of $29,855,418.06, from March 1, 2020 through March 31, 2020, as reflected in Exhibit 1.",
      "title": "Accounts Payable Warrants - Fiscal Year 2019-2020 - As of March 31, 2020",
      "vendorNo": null
    },
    {
      "agendaNumber": "P.-5",
      "agendaSequence": 42,
      "attachments": [
        {
          "name": "20-0666 Payroll Warrants and Direct Deposits—Fiscal Year 2019-2020 - As of January 31, 2020",
          "url": "https://legistar.granicus.com/ousd/attachments/94834.pdf"
        }
      ],
      "consentSection": "general",
      "file": "20-0666",
      "fundingSource": null,
      "group": "Chief Business Officer",
      "history": [
        {
          "action": "Adopted on the General Consent Report",
          "body": "Board of Education",
          "consent": true,
          "date": "2020-05-13",
          "eventId": 4590,
          "historyId": 300290,
          "motion": "A motion was made by Yee, seconded by HintonHodge, to Approve the General Consent Report. The motion carried by the following vote",